{
  "$schema": "http://json-schema.org/draft-07/schema#",
  "title": "ZAP Evidence Packet (v0.1)",
  "type": "object",
  "additionalProperties": false,
  "required": [
    "zap",
    "type",
    "id",
    "ts",
    "missionId",
    "stepId",
    "phase",
    "command",
    "exit",
    "digest",
    "at"
  ],
  "properties": {
    "zap": {
      "type": "string",
      "enum": [
        "0.1"
      ],
      "description": "ZAP protocol version (0.1 = the v0 slice of issue #809)"
    },
    "type": {
      "type": "string",
      "enum": [
        "evidence"
      ]
    },
    "id": {
      "type": "string",
      "minLength": 1,
      "description": "Unique message id (host: UUID v4)"
    },
    "ts": {
      "type": "string",
      "pattern": "^\\d{4}-\\d{2}-\\d{2}T\\d{2}:\\d{2}:\\d{2}(\\.\\d+)?Z$",
      "description": "ISO-8601 UTC with Z suffix"
    },
    "missionId": {
      "type": "string",
      "minLength": 1
    },
    "stepId": {
      "type": "string",
      "minLength": 1
    },
    "phase": {
      "type": "string",
      "enum": [
        "red",
        "green",
        "refactor",
        "verify"
      ]
    },
    "command": {
      "type": "string",
      "minLength": 1,
      "description": "Echo of the executed command (a certified fact)"
    },
    "exit": {
      "type": "integer",
      "description": "Real process exit code; 124 = timeout convention; can be negative on signals"
    },
    "digest": {
      "type": "string",
      "pattern": "^[a-f0-9]{64}$",
      "description": "sha256 hex of the captured combined output"
    },
    "at": {
      "type": "string",
      "pattern": "^\\d{4}-\\d{2}-\\d{2}T\\d{2}:\\d{2}:\\d{2}(\\.\\d+)?Z$",
      "description": "When the step completed"
    },
    "durationMs": {
      "type": "integer",
      "minimum": 0
    },
    "output": {
      "type": "string",
      "description": "Capped preview (2000 chars); the digest covers the FULL output"
    }
  }
}
